chapter,verse,text
33,35,إِنَّ الْمُسْلِمِينَ وَالْمُسْلِمَاتِ وَالْمُؤْمِنِينَ وَالْمُؤْمِنَاتِ وَالْقَانِتِينَ وَالْقَانِتَاتِ وَالصَّادِقِينَ وَالصَّادِقَاتِ وَالصَّابِرِينَ وَالصَّابِرَاتِ وَالْخَاشِعِينَ وَالْخَاشِعَاتِ وَالْمُتَصَدِّقِينَ وَالْمُتَصَدِّقَاتِ وَالصَّائِمِينَ وَالصَّائِمَاتِ وَالْحَافِظِينَ فُرُوجَهُمْ وَالْحَافِظَاتِ وَالذَّاكِرِينَ اللَّهَ كَثِيرًا وَالذَّاكِرَاتِ أَعَدَّ اللَّهُ لَهُم مَّغْفِرَةً وَأَجْرًا عَظِيمًا
33,36,وَمَا كَانَ لِمُؤْمِنٍ وَلَا مُؤْمِنَةٍ إِذَا قَضَى اللَّهُ وَرَسُولُهُ أَمْرًا أَن يَكُونَ لَهُمُ الْخِيَرَةُ مِنْ أَمْرِهِمْ وَمَن يَعْصِ اللَّهَ وَرَسُولَهُ فَقَدْ ضَلَّ ضَلَالًا مُّبِينًا
33,38,مَّا كَانَ عَلَى النَّبِيِّ مِنْ حَرَجٍ فِيمَا فَرَضَ اللَّهُ لَهُ سُنَّةَ اللَّهِ فِي الَّذِينَ خَلَوْا مِن قَبْلُ وَكَانَ أَمْرُ اللَّهِ قَدَرًا مَّقْدُورًا
33,39,الَّذِينَ يُبَلِّغُونَ رِسَالَاتِ اللَّهِ وَيَخْشَوْنَهُ وَلَا يَخْشَوْنَ أَحَدًا إِلَّا اللَّهَ وَكَفَىٰ بِاللَّهِ حَسِيبًا
33,40,مَّا كَانَ مُحَمَّدٌ أَبَا أَحَدٍ مِّن رِّجَالِكُمْ وَلَـٰكِن رَّسُولَ اللَّهِ وَخَاتَمَ النَّبِيِّينَ وَكَانَ اللَّهُ بِكُلِّ شَيْءٍ عَلِيمًا
33,41,يَا أَيُّهَا الَّذِينَ آمَنُوا اذْكُرُوا اللَّهَ ذِكْرًا كَثِيرًا
33,44,تَحِيَّتُهُمْ يَوْمَ يَلْقَوْنَهُ سَلَامٌ وَأَعَدَّ لَهُمْ أَجْرًا كَرِيمًا
33,47,وَبَشِّرِ الْمُؤْمِنِينَ بِأَنَّ لَهُم مِّنَ اللَّهِ فَضْلًا كَبِيرًا
33,48,وَلَا تُطِعِ الْكَافِرِينَ وَالْمُنَافِقِينَ وَدَعْ أَذَاهُمْ وَتَوَكَّلْ عَلَى اللَّهِ وَكَفَىٰ بِاللَّهِ وَكِيلًا
33,49,يَا أَيُّهَا الَّذِينَ آمَنُوا إِذَا نَكَحْتُمُ الْمُؤْمِنَاتِ ثُمَّ طَلَّقْتُمُوهُنَّ مِن قَبْلِ أَن تَمَسُّوهُنَّ فَمَا لَكُمْ عَلَيْهِنَّ مِنْ عِدَّةٍ تَعْتَدُّونَهَا فَمَتِّعُوهُنَّ وَسَرِّحُوهُنَّ سَرَاحًا جَمِيلًا
33,50,يَا أَيُّهَا النَّبِيُّ إِنَّا أَحْلَلْنَا لَكَ أَزْوَاجَكَ اللَّاتِي آتَيْتَ أُجُورَهُنَّ وَمَا مَلَكَتْ يَمِينُكَ مِمَّا أَفَاءَ اللَّهُ عَلَيْكَ وَبَنَاتِ عَمِّكَ وَبَنَاتِ عَمَّاتِكَ وَبَنَاتِ خَالِكَ وَبَنَاتِ خَالَاتِكَ اللَّاتِي هَاجَرْنَ مَعَكَ وَامْرَأَةً مُّؤْمِنَةً إِن وَهَبَتْ نَفْسَهَا لِلنَّبِيِّ إِنْ أَرَادَ النَّبِيُّ أَن يَسْتَنكِحَهَا خَالِصَةً لَّكَ مِن دُونِ الْمُؤْمِنِينَ قَدْ عَلِمْنَا مَا فَرَضْنَا عَلَيْهِمْ فِي أَزْوَاجِهِمْ وَمَا مَلَكَتْ أَيْمَانُهُمْ لِكَيْلَا يَكُونَ عَلَيْكَ حَرَجٌ وَكَانَ اللَّهُ غَفُورًا رَّحِيمًا
33,52,لَّا يَحِلُّ لَكَ النِّسَاءُ مِن بَعْدُ وَلَا أَن تَبَدَّلَ بِهِنَّ مِنْ أَزْوَاجٍ وَلَوْ أَعْجَبَكَ حُسْنُهُنَّ إِلَّا مَا مَلَكَتْ يَمِينُكَ وَكَانَ اللَّهُ عَلَىٰ كُلِّ شَيْءٍ رَّقِيبًا
33,53,يَا أَيُّهَا الَّذِينَ آمَنُوا لَا تَدْخُلُوا بُيُوتَ النَّبِيِّ إِلَّا أَن يُؤْذَنَ لَكُمْ إِلَىٰ طَعَامٍ غَيْرَ نَاظِرِينَ إِنَاهُ وَلَـٰكِنْ إِذَا دُعِيتُمْ فَادْخُلُوا فَإِذَا طَعِمْتُمْ فَانتَشِرُوا وَلَا مُسْتَأْنِسِينَ لِحَدِيثٍ إِنَّ ذَٰلِكُمْ كَانَ يُؤْذِي النَّبِيَّ فَيَسْتَحْيِي مِنكُمْ وَاللَّهُ لَا يَسْتَحْيِي مِنَ الْحَقِّ وَإِذَا سَأَلْتُمُوهُنَّ مَتَاعًا فَاسْأَلُوهُنَّ مِن وَرَاءِ حِجَابٍ ذَٰلِكُمْ أَطْهَرُ لِقُلُوبِكُمْ وَقُلُوبِهِنَّ وَمَا كَانَ لَكُمْ أَن تُؤْذُوا رَسُولَ اللَّهِ وَلَا أَن تَنكِحُوا أَزْوَاجَهُ مِن بَعْدِهِ أَبَدًا إِنَّ ذَٰلِكُمْ كَانَ عِندَ اللَّهِ عَظِيمًا
33,55,لَّا جُنَاحَ عَلَيْهِنَّ فِي آبَائِهِنَّ وَلَا أَبْنَائِهِنَّ وَلَا إِخْوَانِهِنَّ وَلَا أَبْنَاءِ إِخْوَانِهِنَّ وَلَا أَبْنَاءِ أَخَوَاتِهِنَّ وَلَا نِسَائِهِنَّ وَلَا مَا مَلَكَتْ أَيْمَانُهُنَّ وَاتَّقِينَ اللَّهَ إِنَّ اللَّهَ كَانَ عَلَىٰ كُلِّ شَيْءٍ شَهِيدًا
33,56,إِنَّ اللَّهَ وَمَلَائِكَتَهُ يُصَلُّونَ عَلَى النَّبِيِّ يَا أَيُّهَا الَّذِينَ آمَنُوا صَلُّوا عَلَيْهِ وَسَلِّمُوا تَسْلِيمًا
33,57,إِنَّ الَّذِينَ يُؤْذُونَ اللَّهَ وَرَسُولَهُ لَعَنَهُمُ اللَّهُ فِي الدُّنْيَا وَالْآخِرَةِ وَأَعَدَّ لَهُمْ عَذَابًا مُّهِينًا
33,58,وَالَّذِينَ يُؤْذُونَ الْمُؤْمِنِينَ وَالْمُؤْمِنَاتِ بِغَيْرِ مَا اكْتَسَبُوا فَقَدِ احْتَمَلُوا بُهْتَانًا وَإِثْمًا مُّبِينًا
33,59,يَا أَيُّهَا النَّبِيُّ قُل لِّأَزْوَاجِكَ وَبَنَاتِكَ وَنِسَاءِ الْمُؤْمِنِينَ يُدْنِينَ عَلَيْهِنَّ مِن جَلَابِيبِهِنَّ ذَٰلِكَ أَدْنَىٰ أَن يُعْرَفْنَ فَلَا يُؤْذَيْنَ وَكَانَ اللَّهُ غَفُورًا رَّحِيمًا
33,64,إِنَّ اللَّهَ لَعَنَ الْكَافِرِينَ وَأَعَدَّ لَهُمْ سَعِيرًا
33,65,خَالِدِينَ فِيهَا أَبَدًا لَّا يَجِدُونَ وَلِيًّا وَلَا نَصِيرًا
33,66,يَوْمَ تُقَلَّبُ وُجُوهُهُمْ فِي النَّارِ يَقُولُونَ يَا لَيْتَنَا أَطَعْنَا اللَّهَ وَأَطَعْنَا الرَّسُولَا
33,68,رَبَّنَا آتِهِمْ ضِعْفَيْنِ مِنَ الْعَذَابِ وَالْعَنْهُمْ لَعْنًا كَبِيرًا
33,69,يَا أَيُّهَا الَّذِينَ آمَنُوا لَا تَكُونُوا كَالَّذِينَ آذَوْا مُوسَىٰ فَبَرَّأَهُ اللَّهُ مِمَّا قَالُوا وَكَانَ عِندَ اللَّهِ وَجِيهًا
33,70,يَا أَيُّهَا الَّذِينَ آمَنُوا اتَّقُوا اللَّهَ وَقُولُوا قَوْلًا سَدِيدًا
33,71,يُصْلِحْ لَكُمْ أَعْمَالَكُمْ وَيَغْفِرْ لَكُمْ ذُنُوبَكُمْ وَمَن يُطِعِ اللَّهَ وَرَسُولَهُ فَقَدْ فَازَ فَوْزًا عَظِيمًا
33,73,لِّيُعَذِّبَ اللَّهُ الْمُنَافِقِينَ وَالْمُنَافِقَاتِ وَالْمُشْرِكِينَ وَالْمُشْرِكَاتِ وَيَتُوبَ اللَّهُ عَلَى الْمُؤْمِنِينَ وَالْمُؤْمِنَاتِ وَكَانَ اللَّهُ غَفُورًا رَّحِيمًا
34,4,لِّيَجْزِيَ الَّذِينَ آمَنُوا وَعَمِلُوا الصَّالِحَاتِ أُولَـٰئِكَ لَهُم مَّغْفِرَةٌ وَرِزْقٌ كَرِيمٌ
34,5,وَالَّذِينَ سَعَوْا فِي آيَاتِنَا مُعَاجِزِينَ أُولَـٰئِكَ لَهُمْ عَذَابٌ مِّن رِّجْزٍ أَلِيمٌ
34,30,قُل لَّكُم مِّيعَادُ يَوْمٍ لَّا تَسْتَأْخِرُونَ عَنْهُ سَاعَةً وَلَا تَسْتَقْدِمُونَ
34,37,وَمَا أَمْوَالُكُمْ وَلَا أَوْلَادُكُم بِالَّتِي تُقَرِّبُكُمْ عِندَنَا زُلْفَىٰ إِلَّا مَنْ آمَنَ وَعَمِلَ صَالِحًا فَأُولَـٰئِكَ لَهُمْ جَزَاءُ الضِّعْفِ بِمَا عَمِلُوا وَهُمْ فِي الْغُرُفَاتِ آمِنُونَ
34,38,وَالَّذِينَ يَسْعَوْنَ فِي آيَاتِنَا مُعَاجِزِينَ أُولَـٰئِكَ فِي الْعَذَابِ مُحْضَرُونَ
35,5,يَا أَيُّهَا النَّاسُ إِنَّ وَعْدَ اللَّهِ حَقٌّ فَلَا تَغُرَّنَّكُمُ الْحَيَاةُ الدُّنْيَا وَلَا يَغُرَّنَّكُم بِاللَّهِ الْغَرُورُ
35,6,إِنَّ الشَّيْطَانَ لَكُمْ عَدُوٌّ فَاتَّخِذُوهُ عَدُوًّا إِنَّمَا يَدْعُو حِزْبَهُ لِيَكُونُوا مِنْ أَصْحَابِ السَّعِيرِ
35,7,الَّذِينَ كَفَرُوا لَهُمْ عَذَابٌ شَدِيدٌ وَالَّذِينَ آمَنُوا وَعَمِلُوا الصَّالِحَاتِ لَهُم مَّغْفِرَةٌ وَأَجْرٌ كَبِيرٌ
35,8,أَفَمَن زُيِّنَ لَهُ سُوءُ عَمَلِهِ فَرَآهُ حَسَنًا فَإِنَّ اللَّهَ يُضِلُّ مَن يَشَاءُ وَيَهْدِي مَن يَشَاءُ فَلَا تَذْهَبْ نَفْسُكَ عَلَيْهِمْ حَسَرَاتٍ إِنَّ اللَّهَ عَلِيمٌ بِمَا يَصْنَعُونَ
35,10,مَن كَانَ يُرِيدُ الْعِزَّةَ فَلِلَّهِ الْعِزَّةُ جَمِيعًا إِلَيْهِ يَصْعَدُ الْكَلِمُ الطَّيِّبُ وَالْعَمَلُ الصَّالِحُ يَرْفَعُهُ وَالَّذِينَ يَمْكُرُونَ السَّيِّئَاتِ لَهُمْ عَذَابٌ شَدِيدٌ وَمَكْرُ أُولَـٰئِكَ هُوَ يَبُورُ
35,20,وَلَا الظُّلُمَاتُ وَلَا النُّورُ
35,29,إِنَّ الَّذِينَ يَتْلُونَ كِتَابَ اللَّهِ وَأَقَامُوا الصَّلَاةَ وَأَنفَقُوا مِمَّا رَزَقْنَاهُمْ سِرًّا وَعَلَانِيَةً يَرْجُونَ تِجَارَةً لَّن تَبُورَ
35,30,لِيُوَفِّيَهُمْ أُجُورَهُمْ وَيَزِيدَهُم مِّن فَضْلِهِ إِنَّهُ غَفُورٌ شَكُورٌ
35,33,جَنَّاتُ عَدْنٍ يَدْخُلُونَهَا يُحَلَّوْنَ فِيهَا مِنْ أَسَاوِرَ مِن ذَهَبٍ وَلُؤْلُؤًا وَلِبَاسُهُمْ فِيهَا حَرِيرٌ
35,35,الَّذِي أَحَلَّنَا دَارَ الْمُقَامَةِ مِن فَضْلِهِ لَا يَمَسُّنَا فِيهَا نَصَبٌ وَلَا يَمَسُّنَا فِيهَا لُغُوبٌ
35,36,وَالَّذِينَ كَفَرُوا لَهُمْ نَارُ جَهَنَّمَ لَا يُقْضَىٰ عَلَيْهِمْ فَيَمُوتُوا وَلَا يُخَفَّفُ عَنْهُم مِّنْ عَذَابِهَا كَذَٰلِكَ نَجْزِي كُلَّ كَفُورٍ
35,39,هُوَ الَّذِي جَعَلَكُمْ خَلَائِفَ فِي الْأَرْضِ فَمَن كَفَرَ فَعَلَيْهِ كُفْرُهُ وَلَا يَزِيدُ الْكَافِرِينَ كُفْرُهُمْ عِندَ رَبِّهِمْ إِلَّا مَقْتًا وَلَا يَزِيدُ الْكَافِرِينَ كُفْرُهُمْ إِلَّا خَسَارًا
36,21,اتَّبِعُوا مَن لَّا يَسْأَلُكُمْ أَجْرًا وَهُم مُّهْتَدُونَ
36,25,إِنِّي آمَنتُ بِرَبِّكُمْ فَاسْمَعُونِ
36,35,لِيَأْكُلُوا مِن ثَمَرِهِ وَمَا عَمِلَتْهُ أَيْدِيهِمْ أَفَلَا يَشْكُرُونَ
36,47,وَإِذَا قِيلَ لَهُمْ أَنفِقُوا مِمَّا رَزَقَكُمُ اللَّهُ قَالَ الَّذِينَ كَفَرُوا لِلَّذِينَ آمَنُوا أَنُطْعِمُ مَن لَّوْ يَشَاءُ اللَّهُ أَطْعَمَهُ إِنْ أَنتُمْ إِلَّا فِي ضَلَالٍ مُّبِينٍ
36,54,فَالْيَوْمَ لَا تُظْلَمُ نَفْسٌ شَيْئًا وَلَا تُجْزَوْنَ إِلَّا مَا كُنتُمْ تَعْمَلُونَ
36,55,إِنَّ أَصْحَابَ الْجَنَّةِ الْيَوْمَ فِي شُغُلٍ فَاكِهُونَ
36,72,وَذَلَّلْنَاهَا لَهُمْ فَمِنْهَا رَكُوبُهُمْ وَمِنْهَا يَأْكُلُونَ
36,73,وَلَهُمْ فِيهَا مَنَافِعُ وَمَشَارِبُ أَفَلَا يَشْكُرُونَ
37,3,فَالتَّالِيَاتِ ذِكْرًا
37,9,دُحُورًا وَلَهُمْ عَذَابٌ وَاصِبٌ
37,22,احْشُرُوا الَّذِينَ ظَلَمُوا وَأَزْوَاجَهُمْ وَمَا كَانُوا يَعْبُدُونَ
37,33,فَإِنَّهُمْ يَوْمَئِذٍ فِي الْعَذَابِ مُشْتَرِكُونَ
37,41,أُولَـٰئِكَ لَهُمْ رِزْقٌ مَّعْلُومٌ
37,42,فَوَاكِهُ وَهُم مُّكْرَمُونَ
37,43,فِي جَنَّاتِ النَّعِيمِ
37,47,لَا فِيهَا غَوْلٌ وَلَا هُمْ عَنْهَا يُنزَفُونَ
37,60,إِنَّ هَـٰذَا لَهُوَ الْفَوْزُ الْعَظِيمُ
37,61,لِمِثْلِ هَـٰذَا فَلْيَعْمَلِ الْعَامِلُونَ
37,62,أَذَٰلِكَ خَيْرٌ نُّزُلًا أَمْ شَجَرَةُ الزَّقُّومِ
37,63,إِنَّا جَعَلْنَاهَا فِتْنَةً لِّلظَّالِمِينَ
37,67,ثُمَّ إِنَّ لَهُمْ عَلَيْهَا لَشَوْبًا مِّنْ حَمِيمٍ
37,80,إِنَّا كَذَٰلِكَ نَجْزِي الْمُحْسِنِينَ
37,81,إِنَّهُ مِنْ عِبَادِنَا الْمُؤْمِنِينَ
37,105,قَدْ صَدَّقْتَ الرُّؤْيَا إِنَّا كَذَٰلِكَ نَجْزِي الْمُحْسِنِينَ
37,107,وَفَدَيْنَاهُ بِذِبْحٍ عَظِيمٍ
37,110,كَذَٰلِكَ نَجْزِي الْمُحْسِنِينَ
37,111,إِنَّهُ مِنْ عِبَادِنَا الْمُؤْمِنِينَ
37,121,إِنَّا كَذَٰلِكَ نَجْزِي الْمُحْسِنِينَ
37,122,إِنَّهُمَا مِنْ عِبَادِنَا الْمُؤْمِنِينَ
37,131,إِنَّا كَذَٰلِكَ نَجْزِي الْمُحْسِنِينَ
37,132,إِنَّهُ مِنْ عِبَادِنَا الْمُؤْمِنِينَ
37,149,فَاسْتَفْتِهِمْ أَلِرَبِّكَ الْبَنَاتُ وَلَهُمُ الْبَنُونَ
37,152,وَلَدَ اللَّهُ وَإِنَّهُمْ لَكَاذِبُونَ
37,163,إِلَّا مَنْ هُوَ صَالِ الْجَحِيمِ
37,170,فَكَفَرُوا بِهِ فَسَوْفَ يَعْلَمُونَ
37,172,إِنَّهُمْ لَهُمُ الْمَنصُورُونَ
38,2,بَلِ الَّذِينَ كَفَرُوا فِي عِزَّةٍ وَشِقَاقٍ
38,24,قَالَ لَقَدْ ظَلَمَكَ بِسُؤَالِ نَعْجَتِكَ إِلَىٰ نِعَاجِهِ وَإِنَّ كَثِيرًا مِّنَ الْخُلَطَاءِ لَيَبْغِي بَعْضُهُمْ عَلَىٰ بَعْضٍ إِلَّا الَّذِينَ آمَنُوا وَعَمِلُوا الصَّالِحَاتِ وَقَلِيلٌ مَّا هُمْ وَظَنَّ دَاوُودُ أَنَّمَا فَتَنَّاهُ فَاسْتَغْفَرَ رَبَّهُ وَخَرَّ رَاكِعًا وَأَنَابَ
38,25,فَغَفَرْنَا لَهُ ذَٰلِكَ وَإِنَّ لَهُ عِندَنَا لَزُلْفَىٰ وَحُسْنَ مَآبٍ
38,26,يَا دَاوُودُ إِنَّا جَعَلْنَاكَ خَلِيفَةً فِي الْأَرْضِ فَاحْكُم بَيْنَ النَّاسِ بِالْحَقِّ وَلَا تَتَّبِعِ الْهَوَىٰ فَيُضِلَّكَ عَن سَبِيلِ اللَّهِ إِنَّ الَّذِينَ يَضِلُّونَ عَن سَبِيلِ اللَّهِ لَهُمْ عَذَابٌ شَدِيدٌ بِمَا نَسُوا يَوْمَ الْحِسَابِ
38,28,أَمْ نَجْعَلُ الَّذِينَ آمَنُوا وَعَمِلُوا الصَّالِحَاتِ كَالْمُفْسِدِينَ فِي الْأَرْضِ أَمْ نَجْعَلُ الْمُتَّقِينَ كَالْفُجَّارِ
38,32,فَقَالَ إِنِّي أَحْبَبْتُ حُبَّ الْخَيْرِ عَن ذِكْرِ رَبِّي حَتَّىٰ تَوَارَتْ بِالْحِجَابِ
38,33,رُدُّوهَا عَلَيَّ فَطَفِقَ مَسْحًا بِالسُّوقِ وَالْأَعْنَاقِ
38,40,وَإِنَّ لَهُ عِندَنَا لَزُلْفَىٰ وَحُسْنَ مَآبٍ
38,46,إِنَّا أَخْلَصْنَاهُم بِخَالِصَةٍ ذِكْرَى الدَّارِ
38,49,هَـٰذَا ذِكْرٌ وَإِنَّ لِلْمُتَّقِينَ لَحُسْنَ مَآبٍ
38,50,جَنَّاتِ عَدْنٍ مُّفَتَّحَةً لَّهُمُ الْأَبْوَابُ
38,55,هَـٰذَا وَإِنَّ لِلطَّاغِينَ لَشَرَّ مَآبٍ
38,56,جَهَنَّمَ يَصْلَوْنَهَا فَبِئْسَ الْمِهَادُ
38,57,هَـٰذَا فَلْيَذُوقُوهُ حَمِيمٌ وَغَسَّاقٌ
38,64,إِنَّ ذَٰلِكَ لَحَقٌّ تَخَاصُمُ أَهْلِ النَّارِ
38,85,لَأَمْلَأَنَّ جَهَنَّمَ مِنكَ وَمِمَّن تَبِعَكَ مِنْهُمْ أَجْمَعِينَ
39,3,أَلَا لِلَّهِ الدِّينُ الْخَالِصُ وَالَّذِينَ اتَّخَذُوا مِن دُونِهِ أَوْلِيَاءَ مَا نَعْبُدُهُمْ إِلَّا لِيُقَرِّبُونَا إِلَى اللَّهِ زُلْفَىٰ إِنَّ اللَّهَ يَحْكُمُ بَيْنَهُمْ فِي مَا هُمْ فِيهِ يَخْتَلِفُونَ إِنَّ اللَّهَ لَا يَهْدِي مَنْ هُوَ كَاذِبٌ كَفَّارٌ
39,10,قُلْ يَا عِبَادِ الَّذِينَ آمَنُوا اتَّقُوا رَبَّكُمْ لِلَّذِينَ أَحْسَنُوا فِي هَـٰذِهِ الدُّنْيَا حَسَنَةٌ وَأَرْضُ اللَّهِ وَاسِعَةٌ إِنَّمَا يُوَفَّى الصَّابِرُونَ أَجْرَهُم بِغَيْرِ حِسَابٍ
39,15,فَاعْبُدُوا مَا شِئْتُم مِّن دُونِهِ قُلْ إِنَّ الْخَاسِرِينَ الَّذِينَ خَسِرُوا أَنفُسَهُمْ وَأَهْلِيهِمْ يَوْمَ الْقِيَامَةِ أَلَا ذَٰلِكَ هُوَ الْخُسْرَانُ الْمُبِينُ
39,16,لَهُم مِّن فَوْقِهِمْ ظُلَلٌ مِّنَ النَّارِ وَمِن تَحْتِهِمْ ظُلَلٌ ذَٰلِكَ يُخَوِّفُ اللَّهُ بِهِ عِبَادَهُ يَا عِبَادِ فَاتَّقُونِ
39,17,وَالَّذِينَ اجْتَنَبُوا الطَّاغُوتَ أَن يَعْبُدُوهَا وَأَنَابُوا إِلَى اللَّهِ لَهُمُ الْبُشْرَىٰ فَبَشِّرْ عِبَادِ
39,18,الَّذِينَ يَسْتَمِعُونَ الْقَوْلَ فَيَتَّبِعُونَ أَحْسَنَهُ أُولَـٰئِكَ الَّذِينَ هَدَاهُمُ اللَّهُ وَأُولَـٰئِكَ هُمْ أُولُو الْأَلْبَابِ
39,20,لَـٰكِنِ الَّذِينَ اتَّقَوْا رَبَّهُمْ لَهُمْ غُرَفٌ مِّن فَوْقِهَا غُرَفٌ مَّبْنِيَّةٌ تَجْرِي مِن تَحْتِهَا الْأَنْهَارُ وَعْدَ اللَّهِ لَا يُخْلِفُ اللَّهُ الْمِيعَادَ
39,22,أَفَمَن شَرَحَ اللَّهُ صَدْرَهُ لِلْإِسْلَامِ فَهُوَ عَلَىٰ نُورٍ مِّن رَّبِّهِ فَوَيْلٌ لِّلْقَاسِيَةِ قُلُوبُهُم مِّن ذِكْرِ اللَّهِ أُولَـٰئِكَ فِي ضَلَالٍ مُّبِينٍ
39,23,اللَّهُ نَزَّلَ أَحْسَنَ الْحَدِيثِ كِتَابًا مُّتَشَابِهًا مَّثَانِيَ تَقْشَعِرُّ مِنْهُ جُلُودُ الَّذِينَ يَخْشَوْنَ رَبَّهُمْ ثُمَّ تَلِينُ جُلُودُهُمْ وَقُلُوبُهُمْ إِلَىٰ ذِكْرِ اللَّهِ ذَٰلِكَ هُدَى اللَّهِ يَهْدِي بِهِ مَن يَشَاءُ وَمَن يُضْلِلِ اللَّهُ فَمَا لَهُ مِنْ هَادٍ
39,24,أَفَمَن يَتَّقِي بِوَجْهِهِ سُوءَ الْعَذَابِ يَوْمَ الْقِيَامَةِ وَقِيلَ لِلظَّالِمِينَ ذُوقُوا مَا كُنتُمْ تَكْسِبُونَ
39,26,فَأَذَاقَهُمُ اللَّهُ الْخِزْيَ فِي الْحَيَاةِ الدُّنْيَا وَلَعَذَابُ الْآخِرَةِ أَكْبَرُ لَوْ كَانُوا يَعْلَمُونَ
39,32,فَمَنْ أَظْلَمُ مِمَّن كَذَبَ عَلَى اللَّهِ وَكَذَّبَ بِالصِّدْقِ إِذْ جَاءَهُ أَلَيْسَ فِي جَهَنَّمَ مَثْوًى لِّلْكَافِرِينَ
39,33,وَالَّذِي جَاءَ بِالصِّدْقِ وَصَدَّقَ بِهِ أُولَـٰئِكَ هُمُ الْمُتَّقُونَ
39,34,لَهُم مَّا يَشَاءُونَ عِندَ رَبِّهِمْ ذَٰلِكَ جَزَاءُ الْمُحْسِنِينَ
39,35,لِيُكَفِّرَ اللَّهُ عَنْهُمْ أَسْوَأَ الَّذِي عَمِلُوا وَيَجْزِيَهُمْ أَجْرَهُم بِأَحْسَنِ الَّذِي كَانُوا يَعْمَلُونَ
39,36,أَلَيْسَ اللَّهُ بِكَافٍ عَبْدَهُ وَيُخَوِّفُونَكَ بِالَّذِينَ مِن دُونِهِ وَمَن يُضْلِلِ اللَّهُ فَمَا لَهُ مِنْ هَادٍ
39,40,مَن يَأْتِيهِ عَذَابٌ يُخْزِيهِ وَيَحِلُّ عَلَيْهِ عَذَابٌ مُّقِيمٌ
39,45,وَإِذَا ذُكِرَ اللَّهُ وَحْدَهُ اشْمَأَزَّتْ قُلُوبُ الَّذِينَ لَا يُؤْمِنُونَ بِالْآخِرَةِ وَإِذَا ذُكِرَ الَّذِينَ مِن دُونِهِ إِذَا هُمْ يَسْتَبْشِرُونَ
39,47,وَلَوْ أَنَّ لِلَّذِينَ ظَلَمُوا مَا فِي الْأَرْضِ جَمِيعًا وَمِثْلَهُ مَعَهُ لَافْتَدَوْا بِهِ مِن سُوءِ الْعَذَابِ يَوْمَ الْقِيَامَةِ وَبَدَا لَهُم مِّنَ اللَّهِ مَا لَمْ يَكُونُوا يَحْتَسِبُونَ
39,48,وَبَدَا لَهُمْ سَيِّئَاتُ مَا كَسَبُوا وَحَاقَ بِهِم مَّا كَانُوا بِهِ يَسْتَهْزِئُونَ
39,51,فَأَصَابَهُمْ سَيِّئَاتُ مَا كَسَبُوا وَالَّذِينَ ظَلَمُوا مِنْ هَـٰؤُلَاءِ سَيُصِيبُهُمْ سَيِّئَاتُ مَا كَسَبُوا وَمَا هُم بِمُعْجِزِينَ
39,53,قُلْ يَا عِبَادِيَ الَّذِينَ أَسْرَفُوا عَلَىٰ أَنفُسِهِمْ لَا تَقْنَطُوا مِن رَّحْمَةِ اللَّهِ إِنَّ اللَّهَ يَغْفِرُ الذُّنُوبَ جَمِيعًا إِنَّهُ هُوَ الْغَفُورُ الرَّحِيمُ
39,57,أَوْ تَقُولَ لَوْ أَنَّ اللَّهَ هَدَانِي لَكُنتُ مِنَ الْمُتَّقِينَ
